{
  "schema_version": "1.0.0",
  "id": "CPEUM_constitucion_politica_de_los_estados_unidos_mexicanos",
  "abbreviation": "CPEUM",
  "name": "CONSTITUCIÓN Política de los Estados Unidos Mexicanos",
  "catalog_number": "001",
  "source": {
    "pdf_url": "https://www.diputados.gob.mx/LeyesBiblio/pdf/CPEUM.pdf",
    "pdf_filename_origen": "CPEUM.pdf",
    "dof_publication": "DOF 05/02/1917",
    "last_reform": "DOF 03/03/2026",
    "captured_at": "2026-03-21T18:30:00Z"
  },
  "preamble": [
    {
      "type": "paragraph",
      "text": "Constitución publicada en el Diario Oficial de la Federación el 5 de febrero de 1917 TEXTO VIGENTE"
    }
  ],
  "structure": [
    {
      "type": "titulo",
      "id": "titulo-primero",
      "heading": "Título Primero",
      "descriptor": null,
      "ordinal": "Primero",
      "content": [],
      "children": [
        {
          "type": "capitulo",
          "id": "titulo-primero.capitulo-i",
          "heading": "Capítulo I",
          "descriptor": "De los Derechos Humanos y sus Garantías",
          "ordinal": "I",
          "content": [
            {
              "type": "reform_note",
              "text": "Denominación del Capítulo reformada DOF 10-06-2011",
              "action": "reformado",
              "dof_date": "10-06-2011"
            }
          ],
          "children": [
            {
              "type": "articulo",
              "id": "titulo-primero.capitulo-i.art-1",
              "heading": "Artículo 1o",
              "descriptor": null,
              "ordinal": "1o",
              "content": [
                {
                  "type": "paragraph",
                  "text": "En los Estados Unidos Mexicanos todas las personas gozarán de los derechos humanos reconocidos en esta Constitución y en los tratados internacionales de los que el Estado Mexicano sea parte, así como de las garantías para su protección, cuyo ejercicio no podrá restringirse ni suspenderse, salvo en los casos y bajo las condiciones que esta Constitución establece."
                },
                {
                  "type": "reform_note",
                  "text": "Párrafo reformado DOF 10-06-2011",
                  "action": "reformado",
                  "dof_date": "10-06-2011"
                },
                {
                  "type": "paragraph",
                  "text": "Las normas relativas a los derechos humanos se interpretarán de conformidad con esta Constitución y con los tratados internacionales de la materia favoreciendo en todo tiempo a las personas la protección más amplia."
                },
                {
                  "type": "reform_note",
                  "text": "Párrafo adicionado DOF 10-06-2011",
                  "action": "adicionado",
                  "dof_date": "10-06-2011"
                },
                {
                  "type": "paragraph",
                  "text": "Está prohibida la esclavitud en los Estados Unidos Mexicanos. Los esclavos del extranjero que entren al territorio nacional alcanzarán, por este solo hecho, su libertad y la protección de las leyes."
                },
                {
                  "type": "paragraph",
                  "text": "Queda prohibida toda discriminación motivada por origen étnico o nacional, el género, la edad, las discapacidades, la condición social, las condiciones de salud, la religión, las opiniones, las preferencias sexuales, el estado civil o cualquier otra que atente contra la dignidad humana y tenga por objeto anular o menoscabar los derechos y libertades de las personas."
                },
                {
                  "type": "reform_note",
                  "text": "Párrafo reformado DOF 04-12-2006, 10-06-2011",
                  "action": "reformado",
                  "dof_date": "10-06-2011"
                }
              ],
              "children": []
            },
            {
              "type": "articulo",
              "id": "titulo-primero.capitulo-i.art-2",
              "heading": "Artículo 2o",
              "descriptor": null,
              "ordinal": "2o",
              "content": [
                {
                  "type": "paragraph",
                  "text": "La Nación Mexicana es única e indivisible, basada en la grandeza de sus pueblos y culturas."
                },
                {
                  "type": "reform_note",
                  "text": "Párrafo reformado DOF 30-09-2024",
                  "action": "reformado",
                  "dof_date": "30-09-2024"
                },
                {
                  "type": "paragraph",
                  "text": "El derecho de los pueblos indígenas a la libre determinación se ejercerá en un marco constitucional de autonomía que asegure la unidad nacional."
                },
                {
                  "type": "apartado",
                  "ordinal": "A",
                  "text": "Esta Constitución reconoce y garantiza el derecho de los pueblos y las comunidades indígenas a la libre determinación y, en consecuencia, a la autonomía para:",
                  "fracciones": [
                    {
                      "type": "fraccion",
                      "ordinal": "I",
                      "text": "Decidir, conforme a sus sistemas normativos y de acuerdo con esta Constitución, sus formas internas de gobierno, de convivencia y de organización social, económica, política y cultural.",
                      "reform_notes": [
                        {
                          "type": "reform_note",
                          "text": "Fracción reformada DOF 30-09-2024",
                          "action": "reformado",
                          "dof_date": "30-09-2024"
                        }
                      ]
                    },
                    {
                      "type": "fraccion",
                      "ordinal": "II",
                      "text": "Aplicar y desarrollar sus propios sistemas normativos en la regulación y solución de sus conflictos internos...",
                      "incisos": [],
                      "reform_notes": [
                        {
                          "type": "reform_note",
                          "text": "Fracción reformada DOF 30-09-2024",
                          "action": "reformado",
                          "dof_date": "30-09-2024"
                        }
                      ]
                    }
                  ],
                  "reform_notes": []
                }
              ],
              "children": []
            }
          ]
        }
      ]
    },
    {
      "type": "transitorios",
      "id": "transitorios",
      "heading": "Transitorios",
      "descriptor": null,
      "ordinal": null,
      "content": [],
      "children": [
        {
          "type": "transitorio_articulo",
          "id": "transitorios.primero",
          "heading": "Primero",
          "descriptor": null,
          "ordinal": "Primero",
          "content": [
            {
              "type": "paragraph",
              "text": "Este decreto entrará en vigor al día siguiente de su publicación en el Diario Oficial de la Federación."
            }
          ],
          "children": []
        }
      ]
    }
  ]
}
