{
  "schema_version": "1.0.0",
  "id": "LCNP_ley_para_conservar_la_neutralidad_del_pais",
  "abbreviation": "LCNP",
  "name": "LEY para Conservar la Neutralidad del País",
  "catalog_number": "271",
  "source": {
    "pdf_url": "https://www.diputados.gob.mx/LeyesBiblio/pdf/176_210618.pdf",
    "pdf_filename_origen": "176_210618.pdf",
    "dof_publication": "DOF10/11/1939",
    "last_reform": "DOF 21/06/2018",
    "captured_at": "2026-04-09T09:44:18.377592+00:00"
  },
  "preamble": [
    {
      "type": "paragraph",
      "text": "Nueva Ley publicada en el Diario Oficial de la Federación el 10 de noviembre de 1939 TEXTO VIGENTE Al margen un sello con el Escudo Nacional, que dice: Estados Unidos Mexicanos.- Presidencia de la República."
    },
    {
      "type": "paragraph",
      "text": "LAZARO CARDENAS, Presidente Constitucional de los Estados Unidos Mexicanos, a sus habitantes, sabed:"
    },
    {
      "type": "paragraph",
      "text": "Que el H. Congreso de la Unión, se ha servido dirigirme el siguiente DECRETO: \"El Congreso de los Estados Unidos Mexicanos, decreta:"
    },
    {
      "type": "paragraph",
      "text": "LEY PARA CONSERVAR LA NEUTRALIDAD DEL PAIS ARTICULO PRIMERO.- No serán admitidos ni podrán permanecer en puertos, fondeaderos o aguas territoriales mexicanos, los submarinos de potencias beligerantes equipados para usos de guerra."
    },
    {
      "type": "paragraph",
      "text": "ARTICULO SEGUNDO.- Se deroga."
    },
    {
      "type": "reform_note",
      "text": "Artículo derogado DOF 21-06-2018",
      "action": "derogado",
      "dof_date": "21-06-2018"
    },
    {
      "type": "paragraph",
      "text": "ARTICULO TERCERO.- No será admitido sobre territorio mexicano, ni podrá permanecer en el mismo o sobre las aguas territoriales, ningún aeroplano o nave aérea militares de país beligerante."
    },
    {
      "type": "paragraph",
      "text": "ARTICULO CUARTO.- No se permitirá que los aeroplanos que se encuentren a bordo de los barcos beligerantes, se separen de los mismos mientras dichos barcos permanezcan en puertos, fondeaderos o aguas territoriales mexicanos."
    },
    {
      "type": "paragraph",
      "text": "Miguel Moreno, D. P.- Guillermo Flores Muñoz, S. P.- José Zavala Ruiz, D. S.- Mauro Angulo, S."
    },
    {
      "type": "paragraph",
      "text": "S.- Rúbricas.\" En cumplimiento de lo dispuesto por la fracción I del artículo 89 de la Constitución Política de los Estados Unidos Mexicanos, y para su debida publicación y observancia, expido la presente Ley en la residencia del Poder Ejecutivo Federal, en la ciudad de México, D. F., a los cinco días del mes de octubre de mil novecientos treinta y nueve.- Lázaro Cárdenas.- Rúbrica.- El Secretario de Estado y del Despacho de Relaciones Exteriores, Eduardo Hay.- Rúbrica.- Al C. Lic. Ignacio García Téllez, Secretario de Gobernación.- Presente."
    },
    {
      "type": "paragraph",
      "text": "ARTÍCULOS TRANSITORIOS DE DECRETOS DE REFORMA DECRETO por el que se reforman y derogan diversas disposiciones del Código de de la Ley para Conservar la Neutralidad del País."
    },
    {
      "type": "paragraph",
      "text": "Publicado en el Diario Oficial de la Federación el 21 de junio de 2018"
    }
  ],
  "structure": [
    {
      "type": "articulo",
      "id": "articulo-articulo-cuart",
      "heading": "Artículo Cuarto",
      "descriptor": null,
      "ordinal": "Artículo Cuarto",
      "content": [
        {
          "type": "paragraph",
          "text": "Se deroga el Artículo Segundo de la Ley para Conservar la Neutralidad del País, para quedar como sigue: ………"
        }
      ],
      "children": []
    },
    {
      "type": "transitorios",
      "id": "transitorios-transitorios",
      "heading": "Transitorio",
      "descriptor": null,
      "ordinal": null,
      "content": [],
      "children": [
        {
          "type": "transitorio_articulo",
          "id": "transitorios-transitorios.transitorio_articulo-unic",
          "heading": "Único",
          "descriptor": null,
          "ordinal": "Único",
          "content": [
            {
              "type": "paragraph",
              "text": "El presente Decreto entrará en vigor al día siguiente de su publicación en el Diario Oficial de la Federación."
            },
            {
              "type": "paragraph",
              "text": "Ciudad de México, a 26 de abril de 2018.- Dip. Edgar Romo García, Presidente.- Sen. Ernesto Cordero Arroyo, Presidente.- Dip. Sofía Del Sagrario De León Maza, Secretaria.- Sen. Juan G. Flores Ramírez, Secretario.- Rúbricas.\" En cumplimiento de lo dispuesto por la fracción I del Artículo 89 de la Constitución Política de los Estados Unidos Mexicanos, y para su debida publicación y observancia, expido el presente Decreto en la Residencia del Poder Ejecutivo Federal, en la Ciudad de México, a trece de junio de dos mil dieciocho.Enrique Peña Nieto.- Rúbrica.- El Secretario de Gobernación, Dr. Jesús Alfonso Navarrete Prida.Rúbrica."
            }
          ],
          "children": []
        }
      ]
    }
  ]
}